fonte,data,item,pagina,dimensao_ivs,codigo_variavel,tipo_relacao_variavel,resumo,origem,municipio_impactado,tipo_abrangencia,tipo_evento,gravidade,observacao,cod_loteamento,nivel_confianca_loteamento,polaridade_evento,tipo_origem_evento
Tribuna Liberal,2026-04-09,Gas R$132 em Hortolândia — alta 7.5% jan-mar/2026,4,renda_trabalho,RT_01,indireta,"Preco medio botijao 13kg passou de R$105,61 (jan) para R$113,54 (mar); maximo R$132; moradora Ana Paula Lara relata impacto no orcamento",Hortolandia,Hortolandia,local,pressao_orcamentaria,alta,Alta continua e disseminada nas revendas; pressao direta sobre orcamento de familias de baixa renda; contexto: tensao EUA-Ira pressiona GLP importado,nao_aplicavel,nao_aplicavel,negativo,economico
Tribuna Liberal,2026-04-09,SAMU Hortolândia — tratativas regionalizacao Nova Odessa e Monte Mor,5,governanca,SMIDS_GOV,contextual,Representantes de Nova Odessa e Monte Mor no Paco Municipal; equipe de Hortolândia apresentou estrutura e exigencias legais; regionalizacao prevista desde 2008,Hortolandia,Hortolandia,local,politica_publica,media,Coordenador Renato Lopes Machado; secretaria-adjunta Jennifer Bazilio; SAMU ja atende chamadas de Sumare; adesao depende do Ministerio da Saude,nao_aplicavel,nao_aplicavel,positivo,institucional
Tribuna Liberal,2026-04-09,Fundo Social — 39 formandos em 3 cursos profissionalizantes,6,renda_trabalho,RT_02,direta,Cursos: Instalacao Fotovoltaica (Senai) + Pascoa Criativa + Trancas Afro (Senac); cerimonia no Centro Paulo Freire; Maria dos Anjos e Zeze Gomes presentes; mais de 1000 formandos em 2025,Hortolandia,Hortolandia,local,politica_publica,media,Acao do Fundo Social; parceria Senai/Senac; programa gratuito com material incluido; depoimento formanda reforca importancia para mulheres,66,alto,positivo,institucional
Tribuna Liberal,2026-04-09,Dupla detida apos perseguicao — Parque Sao Jorge,6,capital_humano,CH_08,indireta,Jovem 19 anos preso e adolescente 17 apreendido; perseguicao iniciada Rua Goias no Parque Sao Jorge; roubo de veiculo com duas mulheres rendidas; colisao em Sumare,Hortolandia,Hortolandia,local,seguranca,alta,Evento central e o roubo com envolvimento de menor de idade; desfecho positivo da acao policial nao apaga manifestacao de vulnerabilidade juvenil,342,baixo,negativo,seguranca
Tribuna Liberal,2026-04-09,Poco artesiano Jd. Mirante improprio para consumo humano,7,infraestrutura_urbana,IU_01,direta,STD acima do limite da Portaria 888/2021; poco interditado desde final de marco; causa: oxidacao interna do reservatorio metalico apos limpeza; prefeitura contratando empresa para manutencao,Hortolandia,Hortolandia,local,infraestrutura,alta,Engenheira ambiental Michelle Gouvea Martins confirmou alteracao pontual; nova analise laboratorial antes de retomada; populacao deve evitar coleta,331,medio,negativo,infraestrutura
Tribuna Liberal,2026-04-09,1o Forum Regional de Transparencia — Camara Municipal de Hortolândia 10/04,4,governanca,SMIDS_GOV,contextual,Evento 10/04 das 9h as 16h na Camara Municipal; publico-alvo: procuradores controladores ouvidores parlamentares prefeitos; inscricoes araras.sp.leg.br/escola,Hortolandia,Hortolandia,local,governanca,media,Camara de Hortolândia como realizadora; tema transparencia em setores publicos; fortalece ambiente institucional que sustenta o Atlas Social,nao_aplicavel,nao_aplicavel,positivo,institucional
