"id_evento","data_publicacao","fonte","titulo","pagina","municipio","localidade","tipo_camada","dimensao_analitica","tipo_relacao_variavel","codigo_variavel","nivel_criticidade","observacao","aproximacao_variavel","nota_analista","cod_loteamento","nivel_confianca_loteamento","papel_no_ciclo","id_caso_pressao","entra_ipst"
"TL_20260120_001","2026-01-20","Tribuna Liberal","Hortolândia inicia Análise de Densidade Larvária do Aedes aegypti em 3.000 imóveis","9","Hortolândia","nao_identificado","GOVERNANCA","capital_humano","indireta","GOV_MUNICIPAL","media","dado_auditavel","","R22 satisfeita: CH_DENGUE_2026 como gatilho (verão + Aedes ativo). ADL: metodologia sistemática feita 3x/ano (janeiro, julho, outubro). 600 imóveis visitados por região × 5 regiões = 3.000 imóveis total. Sorteio define quarteirões por região. Resultado gera Índice de Breteau (larvas por imóvel): 0-1 = baixo; 1-4 = médio; acima de 4 = alto. DADO CRÍTICO: índice Breteau obtido em janeiro de 2025 foi 6.2 — considerado ALTO. Este baseline será fundamental para comparar com o resultado de jan/2026 quando divulgado. Previsão: 15 dias para conclusão (condicionado às chuvas). UVZ = Unidade de Vigilância de Zoonoses, órgão da Secretaria de Saúde. Moradores orientados a permitir entrada dos agentes (identificados com crachá + uniforme; dúvidas: (19) 3897-3312 / 3897-5974). Vacinação dengue disponível nas UBSs para 6-16 anos das 7h30 às 15h30. cod_loteamento: nao_identificado (ação em todas as 5 regiões da cidade); nivel_confianca_loteamento: baixo. | edicao=9656","nao_identificado","baixo","resposta","CH_DENGUE_2026","nao"
"TL_20260120_002","2026-01-20","Tribuna Liberal","PAT de Hortolândia abre a semana com 33 vagas de emprego","9","Hortolândia","Jardim Metropolitan","GOVERNANCA","renda_trabalho","indireta","GOV_MUNICIPAL","baixa","dado_auditavel","","33 vagas: 20 operador de telemarketing; 12 operador de máquinas fixas; 1 soldador. Candidaturas: online (Portal Emprega Brasil) ou presencial no PAT, Praça de Atendimento do Paço Municipal, Rua Professora Celina Franceschini Bueno 100, Jardim Metropolitan; seg-sex 8h-16h30. Documentação presencial: RG + CPF + CTPS (físico ou digital); currículo e comprovante residência opcionais. Contexto histórico: 2º Feirão de Empregos (outubro/2025) = 2.000 pessoas atendidas, 70 empresas, 3.000 vagas disponibilizadas. Perfil das vagas desta semana: operações industriais/serviços (telemarketing + máquinas + solda) — compatível com perfil produtivo da mão de obra CadÚnico. cod_loteamento: Jardim Metropolitan; nivel_confianca_loteamento: alto. | edicao=9656","nao_identificado","baixo","nao_aplicavel","","nao"
"TL_20260120_003","2026-01-20","Tribuna Liberal","Motociclista morre após bater em carro capotado na Rodovia SP-101 que liga Campinas a Hortolândia","9","Regional","Regional","PRESSAO_SOCIAL","capital_humano","direta","SMIDS_EXT","alerta","dado_auditavel","","Colisão múltipla (3 veículos) na SP-101 (Rodovia Jornalista Francisco Aguirre Proença), km 5, madrugada de 19/01. Dinâmica: carro capotou + ficou parado nas faixas 1 e 2 → motocicleta não desviou → colisão → motociclista lançado ao chão → resgatado mas foi a óbito. Terceiro veículo também colidiu. R21: morte + acidente viário = direta, NUNCA contextual. Nota analítica: em 14/01 (9651 E4), este ciclo havia recebido sinal_desfecho com base em queda de -26,7% nas mortes regionais jan-mar/2025 vs jan-mar/2024. Esta morte em jan/2026 indica que o ciclo permanece ativo → agravamento revisa a perspectiva de desfecho. Relevância para Hortolândia: SP-101 é o eixo principal de acesso/saída da cidade em direção a Campinas — via utilizada por parcela significativa dos trabalhadores CadÚnico. Condição A: PRESSAO_SOCIAL + alerta + dado_auditavel. cod_loteamento: nao_identificado (rodovia); nivel_confianca_loteamento: baixo. | edicao=9656","nao_identificado","baixo","agravamento","CH_MORTES_TRANSITO_REGIONAL_2025","sim"
"TL_20260120_004","2026-01-20","Tribuna Liberal","Homem é preso por violência doméstica e tráfico de drogas no Jardim São Sebastião em Hortolândia","9","Hortolândia","Jardim São Sebastião","PRESSAO_SOCIAL","capital_humano","direta","SMIDS_EXT","alerta","dado_auditavel","","Primeiro registro do ciclo CH_VIOLENCIA_DOMESTICA_HORTO_2026 no corpus. Ocorrência: sábado 17/01, Jardim São Sebastião. Dinâmica: PM acionada após denúncia de violência doméstica → vítima relatou drogas na residência → 176g maconha apreendida → agressor preso. Desfecho vítima: crise convulsiva durante atendimento; socorrida pelo Samu. R21: risco grave à integridade física (crise convulsiva = emergência médica) → NUNCA contextual → direta. Condição A: PRESSAO_SOCIAL + alerta + dado_auditavel. Dupla natureza do evento: violência doméstica (primária) + tráfico (secundário — revelado pela própria vítima). Para fins de ciclo: registrado como CH_VIOLENCIA_DOMESTICA_HORTO_2026 por ser a motivação principal e por ter maior relevância para análise de vulnerabilidade familiar CadÚnico. R25: violência doméstica é fenômeno coletivo, recorrente, altera condições de segurança das famílias vulneráveis. cod_loteamento: Jardim São Sebastião; nivel_confianca_loteamento: alto. | edicao=9656","nao_identificado","baixo","emergencia","CH_VIOLENCIA_DOMESTICA_HORTO_2026","sim"
"TL_20260120_005","2026-01-20","Tribuna Liberal","Dupla é presa por tráfico de drogas no Jardim Amanda em Hortolândia","9","Hortolândia","Jardim Amanda","PRESSAO_SOCIAL","capital_humano","direta","SMIDS_EXT","alta","dado_auditavel","","Segunda entrada do ciclo CH_TRAFICO_HORTO_2026 (primeiro: E6 edicao 9654, Jardim Santiago). Ocorrência: domingo 18/01, Jardim Amanda. Dois homens presos em flagrante; tentativa de fuga + perseguição a pé. Apreensões: maconha + cocaína + dry + celular. Caracterização: 'área conhecida pelo comércio de entorpecentes' — linguagem jornalística confirma fenômeno recorrente e territorialmente identificado (R25 reforçado). Acumulação territorial Jardim Amanda: dengue (E4+E5/9651), abrigos vandalizados (E2+E3/9652), homicídio por arma de fogo (E2/9653), CRAS/CadÚnico (E3/9653), complexo esportivo (E5/9654), agora tráfico estabelecido. O Jardim Amanda emerge como território prioritário para análise de vulnerabilidade multidimensional no Atlas Social. entra_ipst: avaliar — com duas entradas no ciclo a série começa a se consolidar; considerar promover a sim na próxima entrada. cod_loteamento: Jardim Amanda; nivel_confianca_loteamento: alto. | edicao=9656","nao_identificado","baixo","agravamento","CH_TRAFICO_HORTO_2026","avaliar"
"TL_20260120_006","2026-01-20","Tribuna Liberal","Estado define audiências públicas para concessão da Bacia Hidrográfica do PCJ com impacto direto em Hortolândia","3","Regional","Regional","GOVERNANCA","infraestrutura_urbana","latente","GOV_ESTADUAL","media","dado_auditavel","","Atualização de E2 (edicao 9655). Datas confirmadas das audiências públicas: (1) presencial — 29/01/2026, 14h, sede da Prefeitura de Campinas; inscrições até 28/01 via site SPI; (2) online — 02/02/2026, 10h; inscrições até 30/01. Consulta pública permanece aberta até 10/02 (contribuições por escrito: segurancahidricasarpcj@cpp.sp.gov.br). Projeto: Concessão Drenagem e Segurança Hídrica: Barragens, Bacia PCJ, R$25 bilhões estaduais + R$1,9 bilhão na concessão em 30 anos. Parceiros: SPI + SEMIL + SP Água. Hortolândia nomeada entre os cinco municípios com reflexos diretos. Nota analítica: publicação das datas no Diário Oficial do Estado confirma avanço do processo → mantém classificação latente mas sinaliza aproximação da decisão. Monitorar publicação do edital (após 10/02). cod_loteamento: nao_identificado; nivel_confianca_loteamento: baixo. | edicao=9656","nao_identificado","baixo","nao_aplicavel","","nao"
"TL_20260120_007","2026-01-20","Tribuna Liberal","Trecho da Estrada Municipal Valêncio Calegari fica interditado para obras do Data Center da Microsoft","3","Hortolândia","nao_identificado","GOVERNANCA","infraestrutura_urbana","indireta","GOV_MUNICIPAL","baixa","dado_auditavel","","Atualização de E8 (edicao 9651). Interdição ativa: trecho entre Honda (Sumaré) e portal Av. São Francisco de Assis/Pague Menos (Hortolândia). Agentes de trânsito no local para orientação. Obras de duplicação + finalização de marginal para acesso/saída da Microsoft. DADO RT NOVO: Data Center Microsoft = ~300.000m², Parque Santo Antônio (Sumaré); ~50 empregos diretos. Para IVS-H: 50 empregos diretos em empresa de alto valor agregado na fronteira Sumaré-Hortolândia é sinal de RT latente. Monitorar impacto nos dados de emprego formal da região (CAGED) para futura proxy RT_02. cod_loteamento: nao_identificado (divisa Sumaré-Hortolândia, área industrial); nivel_confianca_loteamento: baixo. | edicao=9656","nao_identificado","baixo","nao_aplicavel","","nao"
